{
  "corpus_binding_hash": "sha256:59e034541e3c1096f311404358031a5dc81fc880123351363713d66c2544ad79",
  "format": "agentsec-independent-review-label-template",
  "pack_id": "reviewer-pack-sha256:58295690c13861a763ed9c202d39fe37642ac0f8d9d2d6e416886184a4a86d90",
  "reviewer_id": "reviewer-a",
  "reviews": [
    {
      "category": null,
      "classification": null,
      "confidence": null,
      "corpus_binding_hash": "sha256:59e034541e3c1096f311404358031a5dc81fc880123351363713d66c2544ad79",
      "correlation": null,
      "disposition": null,
      "evidence_locations": [],
      "finding_summary": null,
      "human_condition_label": null,
      "observed_finding": null,
      "pack_id": "reviewer-pack-sha256:58295690c13861a763ed9c202d39fe37642ac0f8d9d2d6e416886184a4a86d90",
      "question_set_sha256": "sha256:5e65b54cfc55a709a9010a6fdabaab4ede0b52b5190aeb365eb6252700861f2d",
      "rationale_code": null,
      "review_case_fingerprint": "sha256:aabb38a949abd3c34c9780cd613b4edd93b69e7e78762171dc07f86aee410685",
      "review_case_id": "review-case-00ae928f46d9cf409d26",
      "review_id": "review:reviewer-a:review-case-00ae928f46d9cf409d26:CAP-CHAIN-001",
      "review_notes": "",
      "reviewer_id": "reviewer-a",
      "rule_id": "CAP-CHAIN-001",
      "source_sha256": "sha256:06fffb0d157b82ffda1762b2bdb9d75e69a37052d9576f9e770313d6ab6ad5bf",
      "status": null
    },
    {
      "category": null,
      "classification": null,
      "confidence": null,
      "corpus_binding_hash": "sha256:59e034541e3c1096f311404358031a5dc81fc880123351363713d66c2544ad79",
      "correlation": null,
      "disposition": null,
      "evidence_locations": [],
      "finding_summary": null,
      "human_condition_label": null,
      "observed_finding": null,
      "pack_id": "reviewer-pack-sha256:58295690c13861a763ed9c202d39fe37642ac0f8d9d2d6e416886184a4a86d90",
      "question_set_sha256": "sha256:86e3d20cbabe4ae5254393ca462de1560e2695a2b1f9bfd11d51918fc8c023de",
      "rationale_code": null,
      "review_case_fingerprint": "sha256:2bbfecc4243d7292af2034bd44869d313664be6faccafef63b1897b50bf26157",
      "review_case_id": "review-case-06f4894ec3df67a05c59",
      "review_id": "review:reviewer-a:review-case-06f4894ec3df67a05c59:CAP-CHAIN-001",
      "review_notes": "",
      "reviewer_id": "reviewer-a",
      "rule_id": "CAP-CHAIN-001",
      "source_sha256": "sha256:d45399e4d637dbeb934386d50f04bdbbc2023ade623b31cdc7dc5f28d9bec5b2",
      "status": null
    },
    {
      "category": null,
      "classification": null,
      "confidence": null,
      "corpus_binding_hash": "sha256:59e034541e3c1096f311404358031a5dc81fc880123351363713d66c2544ad79",
      "correlation": null,
      "disposition": null,
      "evidence_locations": [],
      "finding_summary": null,
      "human_condition_label": null,
      "observed_finding": null,
      "pack_id": "reviewer-pack-sha256:58295690c13861a763ed9c202d39fe37642ac0f8d9d2d6e416886184a4a86d90",
      "question_set_sha256": "sha256:e89d418b9545cb9df139473456464935ae1ad335d3808ac996c04ac9a4bbcf0c",
      "rationale_code": null,
      "review_case_fingerprint": "sha256:c49931eaa088eb0e31dff70a31504b0df394c1359b33c7fe266d0fb0c274f0f2",
      "review_case_id": "review-case-07b5af6d2e9751112094",
      "review_id": "review:reviewer-a:review-case-07b5af6d2e9751112094:CAP-CHAIN-001",
      "review_notes": "",
      "reviewer_id": "reviewer-a",
      "rule_id": "CAP-CHAIN-001",
      "source_sha256": "sha256:4fb5ff4dd4c068fbfc19f6d3f49e4cb399313376d1ca52772a018646678e83cf",
      "status": null
    },
    {
      "category": null,
      "classification": null,
      "confidence": null,
      "corpus_binding_hash": "sha256:59e034541e3c1096f311404358031a5dc81fc880123351363713d66c2544ad79",
      "correlation": null,
      "disposition": null,
      "evidence_locations": [],
      "finding_summary": null,
      "human_condition_label": null,
      "observed_finding": null,
      "pack_id": "reviewer-pack-sha256:58295690c13861a763ed9c202d39fe37642ac0f8d9d2d6e416886184a4a86d90",
      "question_set_sha256": "sha256:93d4cdc82481c0a63363c1b85f1e8d952f78c74fe7ddbd6ae7be505ccb2e0c3a",
      "rationale_code": null,
      "review_case_fingerprint": "sha256:886dc375e25845b563d4b60057d8e8f89afd57ce1ee344907acb74df0100f191",
      "review_case_id": "review-case-10cac34e3c5aa3f50781",
      "review_id": "review:reviewer-a:review-case-10cac34e3c5aa3f50781:CAP-CHAIN-001",
      "review_notes": "",
      "reviewer_id": "reviewer-a",
      "rule_id": "CAP-CHAIN-001",
      "source_sha256": "sha256:4bf34ee9d926f8b410dbd828ae3b2b9a2c4ec334478c52489381882148cf7b49",
      "status": null
    },
    {
      "category": null,
      "classification": null,
      "confidence": null,
      "corpus_binding_hash": "sha256:59e034541e3c1096f311404358031a5dc81fc880123351363713d66c2544ad79",
      "correlation": null,
      "disposition": null,
      "evidence_locations": [],
      "finding_summary": null,
      "human_condition_label": null,
      "observed_finding": null,
      "pack_id": "reviewer-pack-sha256:58295690c13861a763ed9c202d39fe37642ac0f8d9d2d6e416886184a4a86d90",
      "question_set_sha256": "sha256:617e9419ab154ed276c218a8f9dfe49696f4a9b0644db101b0d544ec67756e66",
      "rationale_code": null,
      "review_case_fingerprint": "sha256:71c0f19945889698c9d93452aa864c5e84f1f3d00ba928101cfc2917df1d9be2",
      "review_case_id": "review-case-2249fc3afc6776e5c877",
      "review_id": "review:reviewer-a:review-case-2249fc3afc6776e5c877:CAP-CHAIN-001",
      "review_notes": "",
      "reviewer_id": "reviewer-a",
      "rule_id": "CAP-CHAIN-001",
      "source_sha256": "sha256:80bac43f364c404fb72f613478603ff2ed043ed912748beeebd64586076f05ae",
      "status": null
    },
    {
      "category": null,
      "classification": null,
      "confidence": null,
      "corpus_binding_hash": "sha256:59e034541e3c1096f311404358031a5dc81fc880123351363713d66c2544ad79",
      "correlation": null,
      "disposition": null,
      "evidence_locations": [],
      "finding_summary": null,
      "human_condition_label": null,
      "observed_finding": null,
      "pack_id": "reviewer-pack-sha256:58295690c13861a763ed9c202d39fe37642ac0f8d9d2d6e416886184a4a86d90",
      "question_set_sha256": "sha256:7b77f076cad09cf1f6e9a1f621851c8bded39bf2e313800b857eddbc6005e5fa",
      "rationale_code": null,
      "review_case_fingerprint": "sha256:222db7d8393a74d28699f4efefc6674dc6eedd146a0a6cfdf34ffab7ae6773f7",
      "review_case_id": "review-case-30f35a946e1d25c530d7",
      "review_id": "review:reviewer-a:review-case-30f35a946e1d25c530d7:CAP-CHAIN-001",
      "review_notes": "",
      "reviewer_id": "reviewer-a",
      "rule_id": "CAP-CHAIN-001",
      "source_sha256": "sha256:ab3102228e43346fc02fd1d101db27cb72e16048b69f40abe7bb91f5a0f232bb",
      "status": null
    },
    {
      "category": null,
      "classification": null,
      "confidence": null,
      "corpus_binding_hash": "sha256:59e034541e3c1096f311404358031a5dc81fc880123351363713d66c2544ad79",
      "correlation": null,
      "disposition": null,
      "evidence_locations": [],
      "finding_summary": null,
      "human_condition_label": null,
      "observed_finding": null,
      "pack_id": "reviewer-pack-sha256:58295690c13861a763ed9c202d39fe37642ac0f8d9d2d6e416886184a4a86d90",
      "question_set_sha256": "sha256:3abff65ac30711e981e463bd7adf190caec171d60ec17fcc4ae61ee3f8a9b9d5",
      "rationale_code": null,
      "review_case_fingerprint": "sha256:62d92954cc8a1f73920b44ac2a2855407747161d553714ba3e2a379d2067495c",
      "review_case_id": "review-case-3d175c4543b41a9d762e",
      "review_id": "review:reviewer-a:review-case-3d175c4543b41a9d762e:CAP-CHAIN-001",
      "review_notes": "",
      "reviewer_id": "reviewer-a",
      "rule_id": "CAP-CHAIN-001",
      "source_sha256": "sha256:eaad8f8c920c3e56aa8d96b23f4ede1e91907da36583cc4242e2a8e7cdcf8d4b",
      "status": null
    },
    {
      "category": null,
      "classification": null,
      "confidence": null,
      "corpus_binding_hash": "sha256:59e034541e3c1096f311404358031a5dc81fc880123351363713d66c2544ad79",
      "correlation": null,
      "disposition": null,
      "evidence_locations": [],
      "finding_summary": null,
      "human_condition_label": null,
      "observed_finding": null,
      "pack_id": "reviewer-pack-sha256:58295690c13861a763ed9c202d39fe37642ac0f8d9d2d6e416886184a4a86d90",
      "question_set_sha256": "sha256:c0a257c86006564cb057953cb41d176adcc921a45d9bdefaf7f3acac03ec83ff",
      "rationale_code": null,
      "review_case_fingerprint": "sha256:91ec6fcf240d9fb4620d360d1db684c1dfc5086818867db4650aabea2fa77308",
      "review_case_id": "review-case-3ee41000015a4bbbebd2",
      "review_id": "review:reviewer-a:review-case-3ee41000015a4bbbebd2:CAP-CHAIN-001",
      "review_notes": "",
      "reviewer_id": "reviewer-a",
      "rule_id": "CAP-CHAIN-001",
      "source_sha256": "sha256:4c18f25604f60ce5370d5c61d9bf92aa726e8b5edf703540d2bb4a1fa9e21d4f",
      "status": null
    },
    {
      "category": null,
      "classification": null,
      "confidence": null,
      "corpus_binding_hash": "sha256:59e034541e3c1096f311404358031a5dc81fc880123351363713d66c2544ad79",
      "correlation": null,
      "disposition": null,
      "evidence_locations": [],
      "finding_summary": null,
      "human_condition_label": null,
      "observed_finding": null,
      "pack_id": "reviewer-pack-sha256:58295690c13861a763ed9c202d39fe37642ac0f8d9d2d6e416886184a4a86d90",
      "question_set_sha256": "sha256:100107049fb086f188e040c9d0175bd4a0292827df6c6bb6a69ee166cf50d483",
      "rationale_code": null,
      "review_case_fingerprint": "sha256:960574b61909b84528903bd3ab57a16e535f82853f98eef93422c79b3803189c",
      "review_case_id": "review-case-4934a357278a2bae5e40",
      "review_id": "review:reviewer-a:review-case-4934a357278a2bae5e40:CAP-CHAIN-001",
      "review_notes": "",
      "reviewer_id": "reviewer-a",